event_ticker,series_ticker,title,sub_title,category,mutually_exclusive,dollar_volume,open_interest,market_count,close_time,actual_status
KXRTFANTASTICFOUR,KXRTFANTASTICFOUR,"""The Fantastic Four: First Steps"" Rotten Tomatoes score?","Jul 28, 2025",Entertainment,False,1588271,870272,11,2025-07-28T14:00:00Z,settled
KXBTC-24NOV1517,KXBTC,"Bitcoin price range on Nov 15, 2024 at 5pm EST?","On Nov 15, 2024",Crypto,True,1587673,889365,40,2024-11-15T22:00:00Z,settled
KXBTC-24DEC0917,KXBTC,"Bitcoin price range on Dec 9, 2024 at 5pm EST?","On Dec 9, 2024",Crypto,True,1585565,879161,40,2024-12-09T22:00:00Z,settled
KXNETFLIXRANKSHOWRUNNERUP-25DEC29,KXNETFLIXRANKSHOWRUNNERUP,#2 US Netflix Show this week?,"The chart published on Dec 30, 2025",Entertainment,True,1583591,1372123,11,2025-12-30T04:59:00Z,settled
KXSONGSONCHARTTSWIFT6-25OCT25,KXSONGSONCHARTTSWIFT6,Will Taylor Swift occupy all Top 6 spots on the Billboard Hot 100 chart for October 25th?,"Oct 25, 2025",Entertainment,False,1580844,1365169,1,2025-10-20T19:33:33.843649Z,settled
FED-24MAR,KXFED,Fed funds rate in Mar 2024?,In Mar 2024,Economics,False,1580810,276507,7,2024-03-20T17:55:00Z,settled
KXHIGHNY-26FEB07,KXHIGHNY,"Highest temperature in NYC on Feb 7, 2026?","On Feb 7, 2026",Climate and Weather,True,1575380,1488175,6,2026-02-08T04:59:00Z,settled
KXTRUMPMENTIONB-25DEC23,KXTRUMPMENTIONB,What will Trump say during his announcement?,"On Dec 22, 2025",Mentions,False,1568841,1326256,25,2025-12-23T04:25:34.759045Z,settled
KXTN7SMOV-25NOV07,KXTN7SMOV,Margin of victory in the TN-07 Special Election?,"Nov 7, 2025",Elections,True,1564809,783257,7,2025-12-07T23:33:41.336693Z,settled
KXBTC-24DEC0517,KXBTC,"Bitcoin price range on Dec 5, 2024 at 5pm EST?","On Dec 5, 2024",Crypto,True,1564578,872266,40,2024-12-05T22:00:00Z,settled
KXBTCD-26FEB1017,KXBTCD,"Bitcoin price on Feb 10, 2026 at 5pm EST?","On Feb 10, 2026 at 5pm EST",Crypto,False,1562608,630776,40,2026-02-10T22:00:00Z,settled
KXNFLMENTION-26JAN18HOUNE,KXNFLMENTION,What will the announcers say during the Houston at New England professional football game?,Houston at New England,Mentions,False,1553331,1098598,22,2026-01-19T01:00:00Z,settled
KXBTCD-24NOV1817,KXBTCD,"Bitcoin price on Nov 18, 2024 at 5pm EST?","On Nov 18, 2024",Crypto,False,1550010,463777,40,2024-11-18T22:00:00Z,settled
KXSOUTHPARKMENTION-25SEP24,KXSOUTHPARKMENTION,What will the South Park characters say during the prediction market episode?,"On Sep 24, 2025",Politics,False,1549304,1048384,26,2025-09-25T03:34:16.799529Z,settled
KXNFLMENTION-26JAN11SFPHI,KXNFLMENTION,What will the announcers say during the San Francisco at Philadelphia professional football game?,San Francisco at Philadelphia,Mentions,False,1545150,1113600,20,2026-01-12T02:30:00Z,settled
KXMAMDANIMENTION-26JAN20,KXMAMDANIMENTION,What will Mamdani say during the MLK Celebration?,"On Jan 19, 2026",Mentions,False,1544661,1061634,13,2026-01-19T22:21:44.073962Z,settled
KXTOPMODEL-26JAN,KXTOPMODEL,What will be the top AI model in Jan 2026?,"On Jan 31, 2026",Science and Technology,True,1542070,1090113,10,2026-01-31T15:00:00Z,settled
KXPAYROLLS-25SEP,KXPAYROLLS,Jobs numbers in Sep 2025?,In Sep 2025,Economics,False,1541042,609418,7,2025-10-03T12:29:00Z,settled
KXTRUMPMENTION-26JAN222,KXTRUMPMENTION,What will Trump say during his NewsNation interview (Part 2)?,"On Jan 21, 2026",Mentions,False,1527570,1451736,16,2026-01-22T13:22:32.668425Z,settled
KXTRUMPPUTIN-25,KXTRUMPPUTIN,Who will attend Trump and Putin's meeting in Alaska on August 15?,"Before Aug 15, 2025",Entertainment,False,1526603,735900,14,2025-08-17T14:00:00Z,settled
KXPAYROLLS-25MAY,KXPAYROLLS,Jobs numbers in May 2025?,In May 2025,Economics,False,1521380,667808,7,2025-06-06T12:25:00Z,settled
KXBTC-24DEC0417,KXBTC,"Bitcoin price range on Dec 4, 2024 at 5pm EST?","On Dec 4, 2024",Crypto,True,1519459,782558,40,2024-12-04T22:00:00Z,settled
KXBTCD-26FEB1617,KXBTCD,"Bitcoin price on Feb 16, 2026 at 5pm EST?","On Feb 16, 2026 at 5pm EST",Crypto,False,1518347,658968,40,2026-02-16T22:00:00Z,settled
KXCPIYOY-25AUG,KXCPIYOY,Inflation in Aug 2025? (CPI YoY),In Aug 2025,Economics,False,1510232,823503,8,2025-09-11T12:29:00Z,settled
KXMUSKDOGE-26,KXMUSKDOGE,Will Elon Musk leave the DOGE?,Leave the DOGE,Politics,False,1507088,495533,6,2025-06-15T14:00:00Z,settled
KXMAYORMINN-26,KXMAYORMINN,Who will win the Mayor election in Minneapolis?,In 2025,Elections,True,1504148,581287,5,2025-11-07T21:56:02.235594Z,settled
KXTRUMPMENTIONB-26JAN28,KXTRUMPMENTIONB,What will Trump say during his radio interview?,"On Jan 27, 2026",Mentions,False,1503219,1355851,25,2026-01-27T21:06:52.535187Z,settled
KXBTCD-26FEB1717,KXBTCD,"Bitcoin price on Feb 17, 2026 at 5pm EST?","On Feb 17, 2026 at 5pm EST",Crypto,False,1500995,598905,40,2026-02-17T22:00:00Z,settled
KXRTNOSFERATU,KXRTNOSFERATU,"""Nosferatu"" Rotten Tomatoes score?",On Monday following wide release,Entertainment,False,1499085,431209,10,2024-12-30T15:00:00Z,settled
KXHIGHCHI-26JAN19,KXHIGHCHI,"Highest temperature in Chicago on Jan 19, 2026?","On Jan 19, 2026",Climate and Weather,True,1498966,1433771,6,2026-01-20T05:59:00Z,settled
KXBTCD-26FEB1217,KXBTCD,"Bitcoin price on Feb 12, 2026 at 5pm EST?","On Feb 12, 2026 at 5pm EST",Crypto,False,1497326,547818,40,2026-02-12T22:00:00Z,settled
KXSBPERFORM-25,KXSBPERFORM,Who will be part of Kendrick’s half-time show?,In 2025,Entertainment,False,1496804,740073,14,2025-02-10T01:47:11.990477Z,settled
KXTRUMPMENTION-26JAN14,KXTRUMPMENTION,What will Trump say during his CBS interview?,"On Jan 13, 2026",Mentions,False,1487741,1244004,18,2026-01-14T15:00:00Z,settled
KXSECPRESSMENTION-26MAR01,KXSECPRESSMENTION,What will Karoline Leavitt say in the next press briefing?,"Feb 10, 2026",Mentions,False,1484049,1216068,30,2026-02-10T20:06:27Z,settled
KXBTCD-24NOV1417,KXBTCD,"Bitcoin price on Nov 14, 2024 at 5pm EST?","On Nov 14, 2024",Crypto,False,1483366,441580,40,2024-11-14T22:00:00Z,settled
KXTRUMPMENTIONB-25DEC18,KXTRUMPMENTIONB,What will Trump say during his Address to the Nation?,"On Dec 17, 2025",Mentions,False,1480948,1055945,26,2025-12-18T15:00:00Z,settled
KXBTC-24NOV1817,KXBTC,"Bitcoin price range on Nov 18, 2024 at 5pm EST?","On Nov 18, 2024",Crypto,True,1479269,835514,40,2024-11-18T22:00:00Z,settled
KXNFLMENTION-26JAN17BUFDEN,KXNFLMENTION,What will the announcers say during the Buffalo at Denver professional football game?,Buffalo at Denver,Mentions,False,1477278,952599,22,2026-01-18T02:30:00Z,settled
SENATEWI-24,SENATEWI,Who will win the Senate race in Wisconsin?,In 2024,Politics,True,1475123,470909,2,2025-01-03T20:20:02.526024Z,settled
KXRFKCOUNT-25,KXRFKCOUNT,How many Senators will vote for RFK as Secretary of HHS?,Before Aug 2025,Politics,True,1471989,810969,13,2025-02-13T17:46:00.892798Z,settled
KXBTC-24NOV2017,KXBTC,"Bitcoin price range on Nov 20, 2024 at 5pm EST?","On Nov 20, 2024",Crypto,True,1470406,844162,40,2024-11-20T22:00:00Z,settled
KXEOWEEK-26JAN31,KXEOWEEK,Will Trump sign an executive order this week (1/25-1/31)?,"Jan 25, 2026 to Jan 31, 2026",Politics,False,1466836,799393,1,2026-02-01T04:59:00Z,settled
KXSECSTATE-26DEC31,KXSECSTATE,Who will be Trump's Secretary of State?,"By Dec 31, 2026",Politics,True,1466324,259318,5,2025-01-21T15:00:19.156043Z,settled
KXBTCMAXMON-BTC-26JAN31,KXBTCMAXMON,How high will Bitcoin get in January?,January,Crypto,False,1463155,593406,8,2026-02-01T04:59:59Z,settled
DCEIL-23DEC31,KXDCEIL,Debt ceiling hike in 2023?,In 2023,Politics,False,1454018,372389,7,2023-06-05T16:53:25.430576Z,settled
FED-23MAY,KXFED,Fed funds rate in May 2023?,In May 2023,Economics,False,1453097,358472,15,2023-05-03T17:55:00Z,settled
KXEOCOUNTDAY3-25JAN22,KXEOCOUNTDAY3,How many Executive Orders will Trump issue on Day 3?,"On Day 3 (January 22, 2025)",Politics,True,1447919,583625,11,2025-01-23T15:00:00Z,settled
KXCPI-25JUN,KXCPI,CPI in Jun 2025?,In Jun 2025,Economics,False,1447516,787188,8,2025-07-15T12:29:00Z,settled
KXAAAGASM-25DEC31,KXAAAGASM,US Gas prices at the end of December?,"On Dec 31, 2025",Economics,False,1440460,798153,10,2025-12-31T04:59:00Z,settled
KXCPI-25AUG,KXCPI,CPI in Aug 2025?,In Aug 2025,Economics,False,1440001,803736,6,2025-09-11T12:25:00Z,settled
KXOSCARNOMACTR-26,KXOSCARNOMACTR,Oscar nominations for Best Actress?,In 2026,Entertainment,False,1439658,665098,19,2026-01-22T15:27:55.499137Z,settled
KXSPACEXCOUNT-26JAN,KXSPACEXCOUNT,How many launches will SpaceX have in Jan 2026?,In Jan 2026,Companies,False,1433590,532849,7,2026-02-01T15:00:00Z,settled
KXELECTIONDAYS,KXELECTIONDAYS,When will the AP call the election?,In 2024,Politics,True,1431987,769970,15,2024-11-07T21:29:47.912803Z,settled
KXRTMARTYSUPREME,KXRTMARTYSUPREME,"""Marty Supreme"" Rotten Tomatoes score?","Dec 29, 2025",Entertainment,False,1429814,1018383,13,2025-12-29T15:00:00Z,settled
SENATENE-24,SENATENE,Who will win the Senate race in Nebraska?,In 2024,Politics,True,1424956,451907,2,2025-01-03T20:20:07.952553Z,settled
KXBTCD-26FEB1917,KXBTCD,"Bitcoin price on Feb 19, 2026 at 5pm EST?","On Feb 19, 2026 at 5pm EST",Crypto,False,1421637,538797,40,2026-02-19T22:00:00Z,settled
KXBTCD-26FEB0217,KXBTCD,"Bitcoin price on Feb 2, 2026 at 5pm EST?","On Feb 2, 2026 at 5pm EST",Crypto,False,1416160,652536,40,2026-02-02T22:00:00Z,settled
KXBTCD-26JAN2717,KXBTCD,"Bitcoin price on Jan 27, 2026 at 5pm EST?","On Jan 27, 2026 at 5pm EST",Crypto,False,1415128,464297,40,2026-01-27T22:00:00Z,settled
KXBTC-24DEC0217,KXBTC,"Bitcoin price range on Dec 2, 2024 at 5pm EST?","On Dec 2, 2024",Crypto,True,1407236,798804,40,2024-12-02T22:00:00Z,settled
KXBTC-24NOV1117,KXBTC,"Bitcoin price range on Nov 11, 2024 at 5pm EST?","On Nov 11, 2024",Crypto,True,1406884,699357,40,2024-11-11T22:00:00Z,settled
TNOTEW-24MAR22,KXTNOTEW,"Treasury 10-year yield on Mar 22, 2024?","On Mar 22, 2024",Financials,True,1404495,1298317,15,2024-03-22T19:25:00Z,settled
KXBTCD-24DEC1017,KXBTCD,"Bitcoin price on Dec 10, 2024 at 5pm EST?","On Dec 10, 2024",Crypto,False,1400609,368699,40,2024-12-10T22:00:00Z,settled
KXWTIMAX-25DEC31,KXWTIMAX,"How high will WTI oil get by Dec 31, 2025?",In 2025,Financials,False,1398700,866954,5,2025-12-31T19:30:00Z,settled
KXBTCD-24NOV1317,KXBTCD,"Bitcoin price on Nov 13, 2024 at 5pm EST?","On Nov 13, 2024",Crypto,False,1395481,403257,40,2024-11-13T22:00:00Z,settled
KXBTCD-26JAN2117,KXBTCD,"Bitcoin price on Jan 21, 2026 at 5pm EST?","On Jan 21, 2026 at 5pm EST",Crypto,False,1394198,522820,40,2026-01-21T22:00:00Z,settled
KXNASDAQ100U-25SEP23H1400,KXNASDAQ100U,"Nasdaq price on Sep 23, 2025 at 2pm EDT?","On Sep 23, 2025 at 2pm EDT",Financials,False,1393634,591271,400,2025-09-23T18:00:00Z,settled
KXFEDMENTION-25OCT,KXFEDMENTION,What Will Powell Say During His October Press Conference?,"On Oct 29, 2025",Politics,False,1391221,919953,40,2025-10-29T22:12:03.53273Z,settled
CABINETTULSI-25,CABINETTULSI,Tulsi Gabbard nominated to the Cabinet?,"Before Feb 1, 2025",Politics,False,1390634,184378,1,2025-01-20T17:06:15.212406Z,settled
KXGRAMSOTY-67,KXGRAMSOTY,Grammy for Song of the Year?,In 2025,Entertainment,True,1388480,924063,9,2025-02-03T04:34:39.399446Z,settled
KXGRAMAOTY-67,KXGRAMAOTY,Grammy Award for Album of the Year?,In 2025,Entertainment,True,1386430,996616,9,2025-02-03T04:51:58.799756Z,settled
KXMADUROOUT-25,KXMADUROOUT,Nicolás Maduro out in November?,In 2025,Politics,False,1385875,659328,1,2025-12-01T15:00:00Z,settled
KXFIGHTMENTION-26JAN31VOLLOP,KXFIGHTMENTION,What will the announcers say during the Volkanovski vs Lopes fight?,Volkanovski vs Lopes,Mentions,False,1379869,1130690,23,2026-02-01T08:20:00Z,settled
KXSKPRES-30,KXSKPRES,Who will win the South Korean presidential election?,In 2030,Politics,True,1377511,919226,9,2025-06-03T19:28:30.086375Z,settled
FED-24JUL,KXFED,Fed funds rate in July?,In Jul 2024,Economics,False,1375175,282341,7,2024-07-31T17:55:00Z,settled
KXTRUMPMENTIONB-26FEB05,KXTRUMPMENTIONB,What will Trump say during his NBC interview?,"On Feb 4, 2026",Mentions,False,1368795,954032,18,2026-02-05T02:45:57Z,settled
KXMANTISFREETHROW-25DEC,KXMANTISFREETHROW,How long will it take for Young Mantis to hit 135 free throws in a row?,In Dec 2025,Social,True,1368790,799453,32,2025-11-18T21:08:18.527771Z,settled
KXBTCD-26FEB1417,KXBTCD,"Bitcoin price on Feb 14, 2026 at 5pm EST?","On Feb 14, 2026 at 5pm EST",Crypto,False,1368017,583467,40,2026-02-14T22:00:00Z,settled
KXNFLMENTION-26JAN10GBCHI,KXNFLMENTION,What will the announcers say during the Green Bay at Chicago professional football game?,Green Bay at Chicago,Mentions,False,1367525,991543,22,2026-01-11T06:00:00Z,settled
KXTOP10BILLBOARDSPOTSTS-25B,KXTOP10BILLBOARDSPOTSTS,How many spots on the Billboard Hot 100's top 10 will Taylor Swift hold for the week of Oct 25th?,"Oct 25, 2025",Entertainment,True,1365050,1156295,10,2025-10-20T19:32:46.269449Z,settled
KXTRUMPMENTION-26FEB12,KXTRUMPMENTION,What will Trump say during the Champion of Coal Event,"On Feb 11, 2026",Mentions,False,1363637,1094015,22,2026-02-11T22:39:38Z,settled
KXRT28YEARSLATERTBT,KXRT28YEARSLATERTBT,"""28 Years Later: The Bone Temple"" Rotten Tomatoes score?","Jan 19, 2026",Entertainment,False,1360391,947424,11,2026-01-19T15:00:00Z,settled
KXZELENSKYYPUTINMEET-26,KXZELENSKYYPUTINMEET,Will Zelenskyy meet with Putin before Jan 2026?,"Before Jan 1, 2026",Social,False,1360093,312349,1,2026-01-01T04:59:00Z,settled
FED-22SEP,KXFED,Fed funds rate in Sep 2022 meeting?,In Sep 2022 meeting,Economics,False,1356683,432751,14,2022-09-21T17:55:59Z,settled
KXFTNMENTION-26JAN12,KXFTNMENTION,What will Ilhan Omar say on Face the Nation?,"On Jan 11, 2026",Mentions,False,1351895,1257180,14,2026-01-12T15:00:00Z,settled
KXSBSETLISTS-25,KXSBSETLISTS,What songs will be played at the half-time show?,In the 2025 Football Championship,Entertainment,False,1351872,675304,13,2025-02-10T01:48:50.794172Z,settled
TIME-24,KXTIME,TIME's Person of the Year for 2024?,In 2024,Entertainment,False,1351031,803417,16,2024-12-12T13:09:59.850141Z,settled
KXEOWEEK-26FEB07,KXEOWEEK,Will Trump sign an executive order this week (2/1-2/7)?,"Feb 1, 2026 to Feb 7, 2026",Politics,False,1345235,810030,1,2026-02-08T04:59:00Z,settled
KXLASTSTATECALL24,KXLASTSTATECALL24,Which state will be called last?,In 2024,Elections,True,1342383,527720,15,2024-11-11T14:09:09.16635Z,settled
KXAAAGASM-25NOV30,KXAAAGASM,Gas prices in the US in Nov 2025?,"On Nov 30, 2025",Economics,False,1335481,644487,10,2025-11-30T04:59:00Z,settled
KXRUBIO-25JUL01,KXRUBIO,Who will replace Marco Rubio as Florida Senator?,Before Jul 2025,Politics,True,1335214,415324,10,2025-01-18T16:38:39.67909Z,settled
KXLATENIGHTMENTION-26JAN21,KXLATENIGHTMENTION,What will Will Smith say during The Tonight Show Starring Jimmy Fallon?,"On Jan 20, 2026",Mentions,False,1332802,1080827,7,2026-01-21T15:00:00Z,settled
KXBTC-24NOV2617,KXBTC,"Bitcoin price range on Nov 26, 2024 at 5pm EST?","On Nov 26, 2024",Crypto,True,1329747,755662,40,2024-11-26T22:00:00Z,settled
KXBTCD-26JAN0617,KXBTCD,"Bitcoin price on Jan 6, 2026 at 5pm EST?","On Jan 6, 2026 at 5pm EST",Crypto,False,1329319,589355,40,2026-01-06T22:00:00Z,settled
KXOSCARACTO-25,KXOSCARACTO,2025 Oscar for Best Actor?,In 2025,Entertainment,True,1327943,972512,10,2025-03-03T03:25:16.285701Z,settled
KXRTSUPERMAN,KXRTSUPERMAN,"""Superman"" Rotten Tomatoes score?","Jul 14, 2025",Entertainment,False,1327939,767024,12,2025-07-14T14:00:00Z,settled
SENATEFL-24,SENATEFL,Who will win the Senate race in Florida?,In 2024,Politics,True,1326469,332198,2,2025-01-03T20:20:06.074601Z,settled
KXNFLMENTION-26JAN18SFSEA,KXNFLMENTION,What will the announcers say during the San Francisco at Seattle professional football game?,San Francisco at Seattle,Mentions,False,1325251,889117,22,2026-01-18T06:00:00Z,settled
KXNETFLIXRANKSHOW-25DEC29,KXNETFLIXRANKSHOW,Top US Netflix Show this week?,"The chart published on Dec 30, 2025",Entertainment,True,1323860,1046862,11,2025-12-30T04:59:00Z,settled
KXHIGHPHIL-26JAN20,KXHIGHPHIL,"Highest temperature in Philadelphia on Jan 20, 2026?","On Jan 20, 2026",Climate and Weather,True,1322340,1151787,6,2026-01-21T04:59:00Z,settled
KXKIMMELMENTION-25SEP23,KXKIMMELMENTION,What will Kimmel say during his show?,"On Sep 23, 2025",Politics,False,1319485,793742,20,2025-09-24T14:53:43.845735Z,settled
LLM1-24DEC31,KXLLM1,Best LLM at the end of the year?,"On Dec 31, 2024",Science and Technology,False,1319352,342105,8,2024-12-31T15:00:00Z,settled
KXTRUMPMENTION-25DEC30,KXTRUMPMENTION,What will Trump say during the Kennedy Center Honors?,"On Dec 30, 2025",Mentions,False,1315276,630479,18,2025-12-24T16:16:09.658748Z,settled
KXBTCD-26FEB0117,KXBTCD,"Bitcoin price on Feb 1, 2026 at 5pm EST?","On Feb 1, 2026 at 5pm EST",Crypto,False,1310593,669548,40,2026-02-01T22:00:00Z,settled
KXSTATESHIFTRIGHT-24,KXSTATESHIFTRIGHT,Which states will move to the right in the Presidential Election?,Before 2024,Elections,False,1306461,201250,5,2025-01-06T19:06:10.276446Z,settled
FED-22DEC,KXFED,Fed funds rate in Dec 2022 meeting?,In Dec 2022 meeting,Economics,False,1306009,438681,19,2022-12-14T18:55:27Z,settled
KXTRUMPSAY-25SEP,KXTRUMPSAY,What will Trump say in Aug 2025?,In Aug 2025,Mentions,False,1305234,1115833,38,2025-09-01T14:00:00Z,settled
KXBTC-24DEC0617,KXBTC,"Bitcoin price range on Dec 6, 2024 at 5pm EST?","On Dec 6, 2024",Crypto,True,1304867,754346,40,2024-12-06T22:00:00Z,settled
KXMELANIAMENTION-26JAN29,KXMELANIAMENTION,What will Melania Trump say during her Fox News interview?,"On Jan 28, 2026",Mentions,False,1304544,1258293,12,2026-01-29T01:58:58.6406Z,settled
KXXRPMAXY-25DEC31,KXXRPMAXY,How high will XRP get this year?,In 2025,Crypto,False,1302988,927003,5,2025-12-31T15:00:00Z,settled
KXBTCD-26JAN2817,KXBTCD,"Bitcoin price on Jan 28, 2026 at 5pm EST?","On Jan 28, 2026 at 5pm EST",Crypto,False,1298301,520514,40,2026-01-28T22:00:00Z,settled
KXEXPAND-26,KXEXPAND,"US controls part of Greenland, Canada, and Panama Canal in 2025?",Before 2026,Politics,False,1297570,337977,1,2026-01-01T07:49:22.5294Z,settled
KXTRUMPSAY-26JAN12,KXTRUMPSAY,What will Trump say this week?,"Before Jan 12, 2026",Mentions,False,1292484,894321,27,2026-01-12T15:00:00Z,settled
KXPRESLEAVESK-25,KXPRESLEAVESK,Will the South Korean President leave office?,Leaves office,Politics,False,1289399,609944,4,2025-04-04T15:22:43.269789Z,settled
KXCANLIBSEATS-25,KXCANLIBSEATS,How many seats will the Liberal Party win in the Canadian election?,In 2025,Elections,True,1286907,565224,10,2025-05-27T16:17:08.211005Z,settled
KXRAINNYC-26FEB11,KXRAINNYC,"Will it rain in NYC on Feb 11, 2026?","On Feb 11, 2026",Climate and Weather,False,1282838,1281181,1,2026-02-12T04:59:00Z,settled
KXRTZOOTOPIA2,KXRTZOOTOPIA2,"""Zootopia 2"" Rotten Tomatoes score?","Dec 1, 2025",Entertainment,False,1282306,763137,11,2025-12-01T15:00:00Z,settled
KXNFLMENTION-25DEC22SFIND,KXNFLMENTION,What will the announcers say during the San Francisco at Indianapolis pro football game?,San Francisco at Indianapolis,Mentions,False,1277535,1001698,21,2025-12-23T17:15:00Z,settled
KXU3-25JUL,KXU3,Unemployment in Jul 2025?,In Jul 2025,Economics,False,1274238,811474,6,2025-08-01T12:29:00Z,settled
KXBTCD-26JAN3014,KXBTCD,"Bitcoin price on Jan 30, 2026 at 2pm EST?","On Jan 30, 2026 at 2pm EST",Crypto,False,1264243,337552,75,2026-01-30T19:00:00Z,settled
KXRTDOGMAN,KXRTDOGMAN,"""Dog Man"" Rotten Tomatoes score?",On Monday following wide release,Entertainment,False,1258789,365109,8,2025-02-03T15:00:00Z,settled
KXTRUMPMENTION-26FEB07,KXTRUMPMENTION,Mention: Trump signs Executive Orders,"On Feb 6, 2026",Mentions,False,1257247,1096795,20,2026-02-07T14:22:59Z,settled
KXVANCEMENTION-26JAN24,KXVANCEMENTION,What will JD Vance say during his remarks at March for Life?,"On Jan 23, 2026",Mentions,False,1256402,1105753,17,2026-01-23T20:31:55.65283Z,settled
KXNFLMENTION-25DEC04DALDET,KXNFLMENTION,What will the announcers say during the Dallas at Detroit pro football game?,"On Dec 4, 2025",Mentions,False,1256210,1050943,26,2025-12-05T14:49:57.319555Z,settled
KXOTEEPSTEIN-26,KXOTEEPSTEIN,Who will vote for releasing the Epstein files in the House?,Before 2026,Politics,False,1250350,613029,35,2025-11-18T21:39:53.738092Z,settled
KXMOSTSTREAMESTSTLOASG-25OCT10,KXMOSTSTREAMESTSTLOASG,Most streamed song on 'The Life of a Showgirl' by Oct 10th?,"By Oct 10, 2025",Entertainment,True,1241951,811680,12,2025-10-10T14:00:00Z,settled
KXBTCD-26FEB0613,KXBTCD,"Bitcoin price on Feb 6, 2026 at 1pm EST?","On Feb 6, 2026 at 1pm EST",Crypto,False,1238972,457605,95,2026-02-06T18:00:00Z,settled
KXHIGHCHI-26JAN09,KXHIGHCHI,"Highest temperature in Chicago on Jan 9, 2026?","On Jan 9, 2026",Climate and Weather,True,1227648,1204607,6,2026-01-10T05:59:00Z,settled
KXBTCD-26FEB1311,KXBTCD,"Bitcoin price on Feb 13, 2026 at 11am EST?","On Feb 13, 2026 at 11am EST",Crypto,False,1225090,445698,75,2026-02-13T16:00:00Z,settled
KXHIGHAUS-24NOV18,KXHIGHAUS,"Highest temperature in Austin on Nov 18, 2024?","On Nov 18, 2024",Climate and Weather,True,1224403,541915,6,2024-11-19T05:59:00Z,settled
KXBTCD-24DEC0317,KXBTCD,"Bitcoin price on Dec 3, 2024 at 5pm EST?","On Dec 3, 2024",Crypto,False,1219508,403267,40,2024-12-03T22:00:00Z,settled
POPVOTEMOVFL-2024,POPVOTEMOVFL,Popular vote margin of victory in Florida?,In 2024,Elections,True,1217439,701319,9,2025-01-06T20:18:45.492337Z,settled
KXNYCMAYORDEBATEMENTION-25OCT16,KXNYCMAYORDEBATEMENTION,What Will The Candidates Say During The NYC Mayoral Debate?,"On Oct 16, 2025",Politics,False,1215642,832825,34,2025-10-17T14:00:00Z,settled
SENATEMI-24,SENATEMI,Who will win the Senate race in Michigan?,In 2024,Politics,True,1215349,268374,2,2025-01-03T20:20:06.593749Z,settled
KXTRUMPMENTIONB-25DEC19,KXTRUMPMENTIONB,What will Trump say during the National Defense Authorization Act signing?,"On Dec 18, 2025",Mentions,False,1210473,1088932,22,2025-12-19T15:00:00Z,settled
FED-24DEC,KXFED,Fed funds rate in Dec 2024?,"In Dec 18, 2024",Economics,False,1209779,226464,10,2024-12-18T18:55:00Z,settled
KXMAYORJERSEY-25,KXMAYORJERSEY,Who will win the Mayor election in Jersey City?,In 2025,Elections,True,1207634,379672,6,2025-12-05T19:10:50.890551Z,settled
KXMAMDANIMENTION-26JAN02,KXMAMDANIMENTION,What will Zohran Mamdani say during his inauguration?,"On Jan 1, 2026",Mentions,False,1204056,937874,16,2026-01-02T15:00:00Z,settled
KXBTCD-26JAN2617,KXBTCD,"Bitcoin price on Jan 26, 2026 at 5pm EST?","On Jan 26, 2026 at 5pm EST",Crypto,False,1202405,453920,40,2026-01-26T22:00:00Z,settled
FED-25DEC,KXFED,Fed funds rate in Dec 2025?,"On Dec 10, 2025",Economics,False,1200154,470389,11,2025-12-10T18:55:00Z,settled
KXBTCD-25DEC1917,KXBTCD,"Bitcoin price on Dec 19, 2025 at 5pm EST?","On Dec 19, 2025 at 5pm EST",Crypto,False,1200124,572547,50,2025-12-19T22:00:00Z,settled
KXTARIFFSC-25MAR01,KXTARIFFSC,Will Trump impose tariffs on any country before Mar 2025?,"Before Mar 1, 2025",Politics,False,1198709,340424,1,2025-02-04T14:33:37.242665Z,settled
KXEOWEEK-25OCT19,KXEOWEEK,Will Trump sign an executive order this week?,"Oct 12, 2025 to Oct 19, 2025",Politics,False,1196137,929754,1,2025-10-19T16:44:23.4881Z,settled
KXBTCD-26JAN1417,KXBTCD,"Bitcoin price on Jan 14, 2026 at 5pm EST?","On Jan 14, 2026 at 5pm EST",Crypto,False,1195515,578200,40,2026-01-14T22:00:00Z,settled
KXNYCSNOWM-25DEC,KXNYCSNOWM,Snow in New York City in Dec 2025?,In Dec 2025,Climate and Weather,False,1193525,478217,7,2026-01-01T18:58:59Z,settled
KXBTCD-24NOV0717,KXBTCD,"Bitcoin price on Nov 7, 2024 at 5pm EST?","On Nov 7, 2024",Crypto,False,1189589,400436,40,2024-11-07T22:00:00Z,settled
KXTRUMPFOOTBALL-26JAN012,KXTRUMPFOOTBALL,Will Donald Trump attend another football game this year?,"On Jan 1, 2026",Entertainment,False,1183501,545537,1,2025-12-13T20:32:35.910775Z,settled
GAMEAWARDS-2024,KXGAMEAWARDS,Game of the Year?,In 2024,Entertainment,False,1182898,629902,14,2024-12-13T04:09:55.392189Z,settled
KXBTCD-26FEB1517,KXBTCD,"Bitcoin price on Feb 15, 2026 at 5pm EST?","On Feb 15, 2026 at 5pm EST",Crypto,False,1178841,555022,40,2026-02-15T22:00:00Z,settled
KXTOP10BILLBOARDSPOTSTS-25,KXTOP10BILLBOARDSPOTSTS,How many spots on the Billboard Hot 100's top 10 will Taylor Swift hold for the week of Oct 18th?,"On Oct 18, 2025",Entertainment,True,1176258,865769,10,2025-10-13T19:04:59.386387Z,settled
KXRECNCBILL-25,KXRECNCBILL,When will a budget reconciliation bill become law?,Before 2025,Politics,False,1172259,605833,9,2025-07-07T11:15:32.012817Z,settled
KXPATELCOUNT-25,KXPATELCOUNT,How many Senators will vote for Kash Patel as Director of the FBI?,Before Aug 2025,Politics,True,1171428,602962,13,2025-02-20T19:26:56.359932Z,settled
BTCMAXY-24DEC31,KXBTCMAXY,How high will Bitcoin get this year?,In 2024,Crypto,False,1168957,415246,8,2025-01-01T00:00:00Z,settled
KXKIMMELMENTION-26JAN13,KXKIMMELMENTION,What will Jimmy Kimmel say during The Late Show with Stephen Colbert?,"On Jan 12, 2026",Mentions,False,1166486,1008673,10,2026-01-13T15:00:00Z,settled
KXHIGHLAX-26FEB07,KXHIGHLAX,"Highest temperature in LA on Feb 7, 2026?","On Feb 7, 2026",Climate and Weather,True,1161874,546991,6,2026-02-08T07:59:00Z,settled
FED-23JUN,KXFED,Fed funds rate in Jun 2023?,In Jun 2023,Economics,False,1159317,354539,15,2023-06-14T17:55:00Z,settled
KXCRYPTORETURNY-25,KXCRYPTORETURNY,Which cryptocurrencies will have positive return this year?,In 2025,Crypto,False,1156812,436095,9,2026-01-01T05:56:13.29357Z,settled
KXTRUMPSAY-26FEB16,KXTRUMPSAY,What will Trump say this week?,"Before Feb 16, 2026",Mentions,False,1156775,843025,26,2026-02-16T15:00:00Z,settled
KXTOPMONTHLY-26JAN,KXTOPMONTHLY,Artist with the most monthly Spotify listeners at the end of Jan 2026?,"On Jan 31, 2026",Entertainment,True,1154999,794531,12,2026-01-31T16:59:00Z,settled
KXBTCD-26JAN2713,KXBTCD,"Bitcoin price on Jan 27, 2026 at 1pm EST?","On Jan 27, 2026 at 1pm EST",Crypto,False,1154415,304521,75,2026-01-27T18:00:00Z,settled
KXBTCD-26FEB0511,KXBTCD,"Bitcoin price on Feb 5, 2026 at 11am EST?","On Feb 5, 2026 at 11am EST",Crypto,False,1152211,349707,75,2026-02-05T16:00:00Z,settled
