event_ticker,series_ticker,title,sub_title,category,mutually_exclusive,dollar_volume,open_interest,market_count,close_time,actual_status
KXHIGHNY-26JAN20,KXHIGHNY,"Highest temperature in NYC on Jan 20, 2026?","On Jan 20, 2026",Climate and Weather,True,1146861,1000581,6,2026-01-21T04:59:00Z,settled
KXBTCD-24NOV2617,KXBTCD,"Bitcoin price on Nov 26, 2024 at 5pm EST?","On Nov 26, 2024",Crypto,False,1144455,327735,40,2024-11-26T22:00:00Z,settled
FED-24MAY,KXFED,Fed funds rate in May 2024?,In May 2024,Economics,False,1144442,162918,7,2024-05-01T17:55:00Z,settled
KXBTCD-26FEB0612,KXBTCD,"Bitcoin price on Feb 6, 2026 at 12pm EST?","On Feb 6, 2026 at 12pm EST",Crypto,False,1140018,471402,95,2026-02-06T17:00:00Z,settled
KXBTCD-26JAN0817,KXBTCD,"Bitcoin price on Jan 8, 2026 at 5pm EST?","On Jan 8, 2026 at 5pm EST",Crypto,False,1139730,506902,40,2026-01-08T22:00:00Z,settled
KXTRUMPMENTIONB-26JAN30,KXTRUMPMENTIONB,What will Trump say during his announcement?,"On Jan 29, 2026",Mentions,False,1137967,827609,28,2026-01-29T23:59:28Z,settled
KXBTCD-24DEC1117,KXBTCD,"Bitcoin price on Dec 11, 2024 at 5pm EST?","On Dec 11, 2024",Crypto,False,1131771,397991,40,2024-12-11T22:00:00Z,settled
KXWEALTHY-25,KXWEALTHY,Wealthiest person in the world in 2025?,In 2025,Economics,False,1130501,527681,7,2025-12-31T15:00:00Z,settled
KXTRUMPMENTION-25DEC20,KXTRUMPMENTION,What will Trump say during his remarks in North Carolina?,"On Dec 19, 2025",Mentions,False,1129121,926685,29,2025-12-20T15:00:00Z,settled
KXBTCD-26FEB0315,KXBTCD,"Bitcoin price on Feb 3, 2026 at 3pm EST?","On Feb 3, 2026 at 3pm EST",Crypto,False,1127198,406321,75,2026-02-03T20:00:00Z,settled
KXGGDRAMAFILM-26,KXGGDRAMAFILM,Golden Globe Award for Best Motion Picture - Drama?,In 2026,Entertainment,True,1123966,888899,16,2026-01-12T04:15:05.524405Z,settled
KXLLM1-25NOV30,KXLLM1,Best AI in Nov 2025?,"On Nov 30, 2025",Science and Technology,True,1116746,731236,6,2025-11-30T15:00:00Z,settled
FEDDECISION-24JUL,KXFEDDECISION,Fed meeting in July?,In Jul 2024,Economics,True,1111574,456757,5,2024-07-31T17:55:00Z,settled
KXHIGHNY-26JAN15,KXHIGHNY,"Highest temperature in NYC on Jan 15, 2026?","On Jan 15, 2026",Climate and Weather,True,1109893,976847,6,2026-01-16T04:59:00Z,settled
KXHIGHCHI-26JAN17,KXHIGHCHI,"Highest temperature in Chicago on Jan 17, 2026?","On Jan 17, 2026",Climate and Weather,True,1109684,1077499,6,2026-01-18T05:59:00Z,settled
RATECUT-24MAY01,KXRATECUT,Fed rate cut by May 2024?,By May 2024,Economics,False,1108591,185424,1,2024-05-02T03:59:00Z,settled
FEDDECISION-24NOV,KXFEDDECISION,Fed decision on Nov 7th meeting?,"On Nov 7, 2024",Economics,True,1104684,558813,5,2024-11-07T18:55:00Z,settled
KXRTLASTBREATH,KXRTLASTBREATH,"""Last Breath"" Rotten Tomatoes score?",On Monday following wide release,Entertainment,False,1102894,268976,11,2025-03-03T15:00:00Z,settled
KXBTCD-26JAN3016,KXBTCD,"Bitcoin price on Jan 30, 2026 at 4pm EST?","On Jan 30, 2026 at 4pm EST",Crypto,False,1102410,279278,75,2026-01-30T21:00:00Z,settled
KXHIGHCHI-26JAN14,KXHIGHCHI,"Highest temperature in Chicago on Jan 14, 2026?","On Jan 14, 2026",Climate and Weather,True,1100701,1079788,6,2026-01-15T05:59:00Z,settled
KXNFLMENTION-26JAN10LACAR,KXNFLMENTION,What will the announcers say during the Los Angeles R at Carolina professional football game?,Los Angeles R at Carolina,Mentions,False,1099373,777781,22,2026-01-11T02:30:00Z,settled
KXALBUMSALESSWIFT-25,KXALBUMSALESSWIFT,How many album sales will 'The Life of a Showgirl' have on the chart dated October 10th?,"On October 10, 2025",Entertainment,False,1095101,434742,23,2025-10-10T03:59:00Z,settled
KXLLM1-25FEB28,KXLLM1,Best AI in Feb 2025?,"On Feb 28, 2025",Science and Technology,True,1094348,458624,5,2025-02-28T15:00:00Z,settled
KXNBAMENTION-26JAN25DENMEM,KXNBAMENTION,What will the announcers say during the Denver at Memphis professional basketball game?,Denver at Memphis,Mentions,False,1089366,895466,15,2026-01-26T01:30:00Z,settled
KXBTCD-26JAN2112,KXBTCD,"Bitcoin price on Jan 21, 2026 at 12pm EST?","On Jan 21, 2026 at 12pm EST",Crypto,False,1085868,358494,75,2026-01-21T17:00:00Z,settled
KXNETFLIXRANKMOVIE-25NOV17,KXNETFLIXRANKMOVIE,Top US Netflix movie this week?,"The chart published on Nov 18, 2025",Entertainment,True,1083962,575215,11,2025-11-18T04:59:00Z,settled
KXRAINNYC-26JAN26,KXRAINNYC,"Will it rain in NYC on Jan 26, 2026?","On Jan 26, 2026",Climate and Weather,False,1082117,1079857,1,2026-01-27T04:59:00Z,settled
KXBTCD-26JAN2217,KXBTCD,"Bitcoin price on Jan 22, 2026 at 5pm EST?","On Jan 22, 2026 at 5pm EST",Crypto,False,1082040,469260,40,2026-01-22T22:00:00Z,settled
KXBTCD-26FEB1310,KXBTCD,"Bitcoin price on Feb 13, 2026 at 10am EST?","On Feb 13, 2026 at 10am EST",Crypto,False,1079912,315760,75,2026-02-13T15:00:00Z,settled
KXNFLMENTION-26JAN11BUFJAC,KXNFLMENTION,What will the announcers say during the Buffalo at Jacksonville professional football game?,Buffalo at Jacksonville,Mentions,False,1078010,752351,20,2026-01-11T23:00:00Z,settled
KXBTC-24NOV2717,KXBTC,"Bitcoin price range on Nov 27, 2024 at 5pm EST?","On Nov 27, 2024",Crypto,True,1074989,699417,40,2024-11-27T22:00:00Z,settled
KXFEDCOMBO-26JAN,KXFEDCOMBO,January 2026 Fed Combo: Rate & Dissents,For Jan 2026,Politics,False,1072671,825005,4,2026-01-28T19:00:00Z,settled
KXETHD-26FEB0617,KXETHD,"Ethereum price on Feb 6, 2026 at 5pm EST?","On Feb 6, 2026 at 5pm EST",Crypto,False,1068231,515282,50,2026-02-06T22:00:00Z,settled
KXBTC-24NOV0817,KXBTC,"Bitcoin price range on Nov 8, 2024 at 5pm EST?","On Nov 8, 2024",Crypto,True,1068181,493300,40,2024-11-08T22:00:00Z,settled
KXBTCD-26FEB0717,KXBTCD,"Bitcoin price on Feb 7, 2026 at 5pm EST?","On Feb 7, 2026 at 5pm EST",Crypto,False,1066937,464927,60,2026-02-07T22:00:00Z,settled
KXRAINNYC-26JAN11,KXRAINNYC,"Will it rain in NYC on Jan 11, 2026?","On Jan 11, 2026",Climate and Weather,False,1066432,1059926,1,2026-01-12T04:59:00Z,settled
KXBTC-24DEC1117,KXBTC,"Bitcoin price range on Dec 11, 2024 at 5pm EST?","On Dec 11, 2024",Crypto,True,1065190,579450,40,2024-12-11T22:00:00Z,settled
KXCPI-25MAY,KXCPI,CPI in May 2025?,In May 2025,Economics,False,1064844,552358,7,2025-06-11T12:25:00Z,settled
KXBTCD-26FEB0614,KXBTCD,"Bitcoin price on Feb 6, 2026 at 2pm EST?","On Feb 6, 2026 at 2pm EST",Crypto,False,1064016,429697,95,2026-02-06T19:00:00Z,settled
KXBTCD-26FEB0618,KXBTCD,"Bitcoin price on Feb 6, 2026 at 6pm EST?","On Feb 6, 2026 at 6pm EST",Crypto,False,1061972,405053,95,2026-02-06T23:00:00Z,settled
KXVANCEMENTION-25DEC17,KXVANCEMENTION,What will JD Vance say during his remarks in Pennsylvania?,"On Dec 16, 2025",Mentions,False,1061884,954945,20,2025-12-16T23:23:08.594691Z,settled
KXBTC-24DEC1017,KXBTC,"Bitcoin price range on Dec 10, 2024 at 5pm EST?","On Dec 10, 2024",Crypto,True,1061763,640164,40,2024-12-10T22:00:00Z,settled
KXLARGETARIFF,KXLARGETARIFF,Will Trump impose large tariffs in his first year?,In 2025,Politics,False,1060180,245964,1,2025-07-30T23:37:17.322965Z,settled
KXBTCD-26JAN3015,KXBTCD,"Bitcoin price on Jan 30, 2026 at 3pm EST?","On Jan 30, 2026 at 3pm EST",Crypto,False,1057412,313939,75,2026-01-30T20:00:00Z,settled
KXOSCARNOMSUPACTO-26,KXOSCARNOMSUPACTO,Oscar nominations for Best Supporting Actor?,In 2026,Entertainment,False,1055369,471935,23,2026-01-22T15:21:51.199174Z,settled
PRESPARTYNM-24,PRESPARTYNM,Who will win New Mexico in the presidential election?,In 2024,Elections,True,1055105,412025,2,2025-01-06T19:45:04.147132Z,settled
KXBTCD-26FEB1110,KXBTCD,"Bitcoin price on Feb 11, 2026 at 10am EST?","On Feb 11, 2026 at 10am EST",Crypto,False,1052597,354725,75,2026-02-11T15:00:00Z,settled
KXBTCD-26FEB0616,KXBTCD,"Bitcoin price on Feb 6, 2026 at 4pm EST?","On Feb 6, 2026 at 4pm EST",Crypto,False,1052548,479297,95,2026-02-06T21:00:00Z,settled
KXNFLMENTION-25DEC25DETMIN,KXNFLMENTION,What will the announcers say during the Detroit at Minnesota pro football game?,Detroit at Minnesota,Mentions,False,1051610,807731,21,2025-12-26T13:30:00Z,settled
KXBTCD-26FEB1811,KXBTCD,"Bitcoin price on Feb 18, 2026 at 11am EST?","On Feb 18, 2026 at 11am EST",Crypto,False,1049690,448807,75,2026-02-18T16:00:00Z,settled
KXNBAMENTION-26FEB11SASLAL,KXNBAMENTION,Mention: San Antonio vs Los Angeles L Professional Basketball Game,San Antonio vs Los Angeles L Professional Basketball Game,Mentions,False,1047102,742242,18,2026-02-11T08:30:00Z,settled
KXJAN6PARDONDAY1-25JAN21,KXJAN6PARDONDAY1,How many Jan 6th protestors will Trump pardon today?,Inauguration Day,Politics,False,1044957,358536,6,2025-01-21T14:11:38.22243Z,settled
KXBTCD-26FEB1611,KXBTCD,"Bitcoin price on Feb 16, 2026 at 11am EST?","On Feb 16, 2026 at 11am EST",Crypto,False,1042913,434380,75,2026-02-16T16:00:00Z,settled
ECDJTBLOWOUT-24,ECDJTBLOWOUT,Trump blowout victory?,In 2024,Elections,False,1040016,187173,1,2025-01-06T20:44:21.487897Z,settled
KXTRUMPMENTION-26JAN15,KXTRUMPMENTION,What will Trump say during the Signing Ceremony?,"On Jan 14, 2026",Mentions,False,1038236,680758,23,2026-01-15T00:21:24.71166Z,settled
KXTRUMPMENTIONB-25DEC17,KXTRUMPMENTIONB,What will Trump say during the Hanukkah Reception?,"On Dec 16, 2025",Mentions,False,1034367,776756,22,2025-12-17T15:00:00Z,settled
KXAPRPOTUSEOY-26JAN01,KXAPRPOTUSEOY,"The President's RCP approval rating on Jan 1, 2026?","On Jan 1, 2026",Politics,True,1034003,545382,12,2026-01-01T16:00:00Z,settled
KXBTCD-26FEB1212,KXBTCD,"Bitcoin price on Feb 12, 2026 at 12pm EST?","On Feb 12, 2026 at 12pm EST",Crypto,False,1032784,387662,75,2026-02-12T17:00:00Z,settled
KXHIGHLAX-25DEC17,KXHIGHLAX,"Highest temperature in LA on Dec 17, 2025?","On Dec 17, 2025",Climate and Weather,True,1030550,574432,6,2025-12-18T07:59:00Z,settled
KXTRUMPMENTION-26FEB19,KXTRUMPMENTION,What will Trump say during his Black History Month Reception?,"On Feb 18, 2026",Mentions,False,1030309,846983,19,2026-02-18T21:16:15Z,settled
KXEARNINGSMENTIONTSLA-25OCT22,KXEARNINGSMENTIONTSLA,What will Tesla say during their next earnings call?,"On Oct 22, 2025",Companies,False,1028373,729545,17,2025-10-23T15:25:07.135886Z,settled
KXBTCD-26FEB1215,KXBTCD,"Bitcoin price on Feb 12, 2026 at 3pm EST?","On Feb 12, 2026 at 3pm EST",Crypto,False,1028329,354113,75,2026-02-12T20:00:00Z,settled
KXWHVISIT-25,KXWHVISIT,Who will visit the White House before Apr 2025?,Before Apr 2025,Politics,False,1027973,454542,15,2025-04-01T14:00:00Z,settled
KXHIGHNY-24NOV13,KXHIGHNY,"Highest temperature in NYC on Nov 13, 2024?","On Nov 13, 2024",Climate and Weather,True,1024554,522128,6,2024-11-14T04:59:00Z,settled
KXBTCD-26JAN1317,KXBTCD,"Bitcoin price on Jan 13, 2026 at 5pm EST?","On Jan 13, 2026 at 5pm EST",Crypto,False,1024062,467647,40,2026-01-13T22:00:00Z,settled
KXRTJURASSICWORLDREBIRTH,KXRTJURASSICWORLDREBIRTH,"""Jurassic World Rebirth"" Rotten Tomatoes score?","Jul 7, 2025",Entertainment,False,1023345,433436,11,2025-07-07T14:00:00Z,settled
KXSECPRESSMENTION-26MAR08,KXSECPRESSMENTION,What will Karoline Leavitt say in the next press briefing?,"Feb 18, 2026",Mentions,False,1020013,785851,27,2026-02-18T19:45:35Z,settled
KXVANCEMENTION-26JAN23,KXVANCEMENTION,What will JD Vance say during his remarks in Ohio?,"On Jan 22, 2026",Mentions,False,1017185,810595,20,2026-01-23T15:00:00Z,settled
KXBTCD-24DEC1817,KXBTCD,"Bitcoin price on Dec 18, 2024 at 5pm EST?","On Dec 18, 2024 at 5pm EST",Crypto,False,1009921,415281,40,2024-12-18T22:00:00Z,settled
KXHIGHLAX-26FEB04,KXHIGHLAX,"Highest temperature in LA on Feb 4, 2026?","On Feb 4, 2026",Climate and Weather,True,1009748,610421,6,2026-02-05T07:59:00Z,settled
KXBTCD-26JAN0717,KXBTCD,"Bitcoin price on Jan 7, 2026 at 5pm EST?","On Jan 7, 2026 at 5pm EST",Crypto,False,1008264,573623,40,2026-01-07T22:00:00Z,settled
KXENDORSECUOMO-25NOV04,KXENDORSECUOMO,Who will endorse Andrew Cuomo in the 2025 NYC Mayoral Race?,Before election day,Elections,False,1006483,410287,6,2025-11-04T15:00:00Z,settled
KXAAAGASW-26FEB09,KXAAAGASW,US Gas prices up this week?,"On Feb 9, 2026",Economics,False,1006028,790985,3,2026-02-09T04:59:00Z,settled
KXNFLMENTION-25DEC29LAATL,KXNFLMENTION,What will the announcers say during the Los Angeles R at Atlanta pro football game?,Los Angeles R at Atlanta,Mentions,False,1005760,857716,20,2025-12-30T06:15:00Z,settled
KXBTCD-26FEB0314,KXBTCD,"Bitcoin price on Feb 3, 2026 at 2pm EST?","On Feb 3, 2026 at 2pm EST",Crypto,False,1005219,309352,75,2026-02-03T19:00:00Z,settled
KXACQUANNOUNCETIKTOK-25,KXACQUANNOUNCETIKTOK,Will an acquisition of TikTok be announced this year?,In 2025,Financials,False,1002582,265734,1,2026-01-01T04:59:00Z,settled
KXCPI-25NOV,KXCPI,CPI in Nov 2025?,In Nov 2025,Economics,False,1002093,446849,5,2025-12-18T13:29:00Z,settled
KXCOLBERTMENTION-26JAN08,KXCOLBERTMENTION,What will Chris Hayes say during The Late Show with Stephen Colbert?,"On Jan 7, 2026",Mentions,False,1001106,891506,10,2026-01-08T15:00:00Z,settled
KXTRUMPMENTION-25DEC16,KXTRUMPMENTION,What will Trump say during the Christmas Reception?,"On Dec 15, 2025",Mentions,False,1000612,733578,18,2025-12-16T15:00:00Z,settled
